{
  "protocol": "CAM/1",
  "message_id": "00000000-0000-4000-8000-000000000011",
  "type": "result",
  "sent_at": "2026-08-21T20:04:00Z",
  "expires_at": "2026-08-21T20:14:00Z",
  "claimed_sender": {
    "vendor": "claude-code",
    "agent_name": "example worker",
    "session_id": "00000000-0000-4000-8000-000000000102",
    "host_id": null
  },
  "recipient": {
    "vendor": "codex",
    "agent_name": "example coordinator",
    "session_id": "00000000-0000-4000-8000-000000000101"
  },
  "reply_to": {
    "transport": "claude_send_message",
    "address": "00000000-0000-4000-8000-000000000102"
  },
  "in_reply_to": "00000000-0000-4000-8000-000000000010",
  "receipt": {
    "status": "completed",
    "for_message_id": "00000000-0000-4000-8000-000000000010",
    "detail": "Synthetic review completed."
  },
  "nonce": null,
  "intent": "Report a completed synthetic review",
  "action": {
    "risk_class": "informational",
    "operation": "report_result",
    "scope": {
      "repositories": [],
      "paths": [],
      "hosts": [],
      "external_recipients": []
    },
    "idempotency_key": "00000000-0000-4000-8000-000000000011"
  },
  "authorization": {
    "basis": "none",
    "authority": null,
    "reference": null,
    "verified_at": null,
    "expires_at": null
  },
  "constraints": {
    "no_repository_changes": true,
    "no_external_side_effects": true,
    "no_secrets": true
  },
  "body": "Review completed; no changes were made.",
  "body_sha256": "bc774752fe032461ee093d4454f150318aaf31c8c45d788534338e58afc0a302",
  "evidence": []
}
